{
  "$schema": "../schema/unit.schema.json",
  "id": "mob6_elite",
  "name": "Гидра",
  "kind": "monster",
  "role": "damage",
  "stats": {
    "hp": 1200,
    "atk": 60,
    "def": 14,
    "spd": 95
  },
  "skills": {
    "basic": "basic_melee",
    "ult": "mob6_elite_tentacles",
    "passives": []
  },
  "visual": {
    "sprite": "mandragora",
    "tint": "#3fa08a",
    "scale": 1.3,
    "hitFx": "fx_hit"
  }
}
