{
  "$schema": "../schema/unit.schema.json",
  "id": "mob_tank",
  "name": "Орк-щитоносец",
  "kind": "monster",
  "role": "tank",
  "stats": {
    "hp": 800,
    "atk": 30,
    "def": 15,
    "spd": 85
  },
  "skills": {
    "basic": "basic_melee",
    "ult": "mob_tank_guard",
    "passives": []
  },
  "visual": {
    "sprite": "tank",
    "hitFx": "fx_hit"
  }
}
