{
  "$schema": "../schema/unit.schema.json",
  "id": "mob6_bosun",
  "name": "Боцман-призрак",
  "kind": "monster",
  "role": "damage",
  "stats": {
    "hp": 1500,
    "atk": 62,
    "def": 14,
    "spd": 95
  },
  "skills": {
    "basic": "basic_melee",
    "ult": "mob6_bosun_all_hands",
    "actives": [
      "mob6_bosun_anchor"
    ],
    "passives": []
  },
  "visual": {
    "sprite": "pirate_skel",
    "tint": "#9fe0d0",
    "scale": 1.3,
    "hitFx": "fx_hit"
  },
  "barks": {
    "start": "Свистать всех наверх! Сто лет по контракту!",
    "half": "Пробоина! Ничего, мы и так на дне.",
    "defeat": "Контракт… кончился? Наконец-то списан на берег.",
    "victory": "В трюм их! Кэп любит новые лица в команде."
  }
}
