{
  "$schema": "../schema/unit.schema.json",
  "id": "mob7_support",
  "name": "Квив",
  "kind": "monster",
  "role": "healer",
  "stats": {
    "hp": 520,
    "atk": 30,
    "def": 8,
    "spd": 105
  },
  "skills": {
    "basic": "basic_ranged",
    "ult": "mob7_support_soul_dance",
    "actives": [
      "mob7_support_soul_mend"
    ],
    "passives": []
  },
  "visual": {
    "sprite": "poporing",
    "tint": "#bfeee6",
    "scale": 0.95,
    "hitFx": "fx_hit",
    "projectile": "fx_magic"
  }
}
