{
  "$schema": "../schema/unit.schema.json",
  "id": "mob2_elite",
  "name": "Орк-берсерк",
  "kind": "monster",
  "role": "damage",
  "stats": {
    "hp": 1050,
    "atk": 58,
    "def": 11,
    "spd": 105
  },
  "skills": {
    "basic": "basic_melee",
    "ult": "mob2_elite_frenzy",
    "passives": []
  },
  "visual": {
    "sprite": "elite",
    "hitFx": "fx_hit"
  }
}
