{
  "$schema": "../schema/unit.schema.json",
  "id": "maze_baphomet_jr",
  "name": "Бафомет-младший",
  "kind": "monster",
  "role": "damage",
  "stats": {
    "hp": 1150,
    "atk": 62,
    "def": 14,
    "spd": 110
  },
  "skills": {
    "basic": "basic_melee",
    "ult": "maze_baphomet_jr_leap",
    "actives": [],
    "passives": []
  },
  "visual": {
    "sprite": "boss2",
    "tint": "#d9b98c",
    "scale": 0.55,
    "hitFx": "fx_hit"
  }
}
