{
  "$schema": "../schema/unit.schema.json",
  "id": "mob_boss2",
  "name": "Бафомет",
  "kind": "boss",
  "role": "damage",
  "stats": {
    "hp": 2800,
    "atk": 100,
    "def": 15,
    "spd": 100
  },
  "skills": {
    "basic": "basic_melee",
    "ult": "mob_boss2_curse",
    "passives": []
  },
  "visual": {
    "sprite": "boss2",
    "hitFx": "fx_hit"
  }
}
